ID,Serving,Preparation_Time,Difficulty,Ingredient,Condiment
7057185,5,2시간 이상,초급,"[재료]: 감자, 염육수, 부케가르니, 마늘, 대파, 통후추, 버터, 우유, 생크림, 소금, 파르메산치즈",양념 없음
7057184,1,15분,아무나,"[재료]: 스파게티, 완두콩, 시금치, 구운 아몬드, 마늘, 엑스트라버진올리브오일, 소금, 그라노파다노치즈, 후추",양념 없음
7057183,4,60분,아무나,"[재료]: 햇감자, 밀가루, 세몰리나, 버터, 계란, 소금, 설탕, 말린 빵가루, 버터, 시나몬파우더, 설탕, 살구",양념 없음
7057182,1,15분,아무나,"[재료]: 파스타, 후추, 페코리노치즈, 버터, 소금",양념 없음
7057181,2,60분,중급,"[재료]: 닭가슴살, 밀가루, 소금, 후추, 달걀, 올리브오일, 레몬, 무염 버터, 밀가루, 닭고기육수, 화이트와인, 레몬즙, 파슬리",양념 없음
7057180,2,20분,초급,"[재료]: 가지, 양배추, 방울토마토, 토마토소스, 모짜렐라치즈, 페타치즈 크럼블, 몬테리잭 슬라이스치즈, 허브솔트, 올리브유",양념 없음
7057179,6 이상,90분,초급,"[재료]: 토마토, 소금, 머스코바도설탕, 황설탕, 레몬즙",양념 없음
7057178,1,20분,아무나,"[재료]: 신라면, 콩나물, 양파, 크래미, 대파 초록, 얼음, 물",양념 없음
7057177,1,30분,아무나,"[재료]: 가리비, 파스타면, 마늘 분말, 레드페퍼, 소금, 파마산치즈가루, 참나물, 올리브오일, 청주, 물, 버터, 후추",양념 없음
7057176,1,10분,아무나,"[재료]: 냉동우동면, 콩나물, 김치, 다진마늘, 간장, 설탕, 미원, 물",양념 없음
7057175,1,30분,아무나,"[재료]: 밥, 새우, 다진양파, 다진마늘, 바질페스토, 치킨스톡 파우더, 참치액, 소금, 레드페퍼, 바질잎, 올리브오일, 우유, 파마산치즈가루, 후추",양념 없음
7057174,3,60분,아무나,"[재료]: 멸치볶음, 고추장볶음, 매운 어묵, 계란말이, 당근채, 짠지채, 절임 오이, 야채, 당귀, 미나리, 김밥용김, 밥, 소금, 참기름, 통깨",양념 없음
7057173,1,15분,아무나,"[재료]: 부추, 밥, 단무지, 참치, 맛소금, 참기름, 통깨, 마요네즈, 스리라차, 후추",양념 없음
7057172,1,10분,아무나,"[재료]: 식빵, 버터, 딸기잼, 바나나",양념 없음
7057171,1,30분,아무나,"[재료]: 공기밥, 만두, 계란, 식용유, 케첩, 진간장, 굴소스, 통깨",양념 없음
7057170,2,15분,아무나,"[재료]: 메밀국수, 쯔유, 시원한 물, 설탕, 쪽파, 무, 마른 김가루, 고추냉이, 방울토마토",양념 없음
7057169,2,15분,중급,"[재료]: 계란, 맛소금, 쇠고기다시다, 다진 당근, 다진 부추, 베이킹소다, 슬라이스치즈, 물",양념 없음
7057168,4,30분,아무나,"[재료(4인분)]: 소고기, 양파, 대파, 다진마늘, 당근, 버섯",양념 없음
7057167,3,15분,아무나,"[재료]: 숙주, 당근, 쪽파, 다진 마늘, 참치액, 참기름, 소금, 통깨",양념 없음
7057166,2,20분,아무나,"[재료]: 콩고기, 떡국떡, 물만두, 대파, 계란, 물","[양념]: 다진 마늘, 참치액, 진간장, 소금"
7057165,2,20분,아무나,"[재료]: 토마토, 감자, 노란파프리카, 빨간 파프리카, 양파, 월계수잎, 바질잎, 소금, 올리브유, 후추",양념 없음
7057164,4,30분,아무나,"[오징어국 재료]: 오징어, 무우, 두부, 양파, 청양고추, 대파","[오징어국 양념]: 다진마늘, 고추가루, 국간장, 참치액젓, 소금"
7057163,2,10분,아무나,"[재료]: 콘옥수수, 양파, 빨강 파프리카, 마요네즈, 설탕, 레몬즙, 파슬리가루",양념 없음
7057162,1,10분,초급,"[재료]: 채수, 소면, 오이, 검정통깨, 게맛살, 생와사비",양념 없음
7057161,3,30분,초급,"[재료]: 알감자, 물, 소금, 버터, 소금, 설탕, 파슬리가루",양념 없음
7057160,2,10분,아무나,"[동치미육수 비빔면 재료]: 오이, 깻잎, 무쌈, 삶은달걀, 면, 양념장, 육수, 깨",양념 없음
7057159,2,10분,아무나,"[보코치니 양상추 샐러드 재료]: 양상추, 키위, 올리브오일, 화이트발사믹, 메이플시럽, 파슬리가루, 방울토마토, 보코치니치즈",양념 없음
7057158,4,30분,중급,"[재료]: 자른미역, 참치캔, 참기름, 양조간장, 물",양념 없음
7057157,3,30분,초급,"[재료]: 감자, 모차렐라치즈, 감자전분, 소금, 후추, 기름",양념 없음
7057156,1,15분,아무나,"[ 볶음밥 재료 ]: 양파, 우삼겹, 밥, 계란, 모짜렐라치즈","[ 양념장 ]: 간장, 다진마늘, 맛술, 설탕, 메이플시럽"
7057155,1,10분,초급,"[ 토스트 재료 ]: 식빵, 계란, 버터, 옥수수콘, 샌드위치햄, 양배추, 소금",양념 없음
7057154,1,15분,아무나,"[재료]: 감자, 양파","[양념]: 식용유, 튀김가루, 물"
7057153,1,30분,아무나,"[재료]: 미나리, 마늘, 밥, 식용유, 굴소스, 참기름",양념 없음
7057152,4,30분,초급,"[재료]: 갈치, 부침가루, 식용유",양념 없음
7057151,2,30분,아무나,"[재료]: 두부, 전분가루, 식용유, 통깨","[양념]: 설탕, 올리고당, 진간장, 굴소스, 다진 마늘, 물"
7057150,1,10분,초급,"[재료]: 올리브유, 애호박, 계란, 소금",양념 없음
7057149,2,20분,아무나,"[재료]: 베이컨, 슬라이스치즈, 밥, 양파, 당근, 청양고추, 식용유","[밥 양념]: 조미김, 참기름, 후추"
7057148,4,60분,아무나,"[재료]: 참치캔, 무, 대파, 양파, 청양고추, 물, 통깨","[양념]: 설탕, 고춧가루, 진간장, 맛술, 다진 마늘, 들기름"
7057147,1,30분,아무나,"[재료]: 파스타면, 토마토소스, 사각 모짜렐라치즈, 양파, 샌드위치햄, 블랙올리브, 다진마늘, 올리브유, 케첩, 후추, 면수",양념 없음
7057146,1,10분,아무나,"[재료]: 사골국물, 밥, 버섯, 햄, 파, 버터, 양파, 체다치즈, 마늘, 소금, 참기름, 후추",양념 없음
7057145,2,10분,아무나,"[재료]: 햄, 양파, 청양고추, 마늘, 참기름, 통깨","[양념장]: 진간장, 설탕, 고추장"
