ID,Serving,Preparation_Time,Difficulty,Ingredient,Condiment
7057366,4,60분,아무나,"[주재료]: 우삼겹, 새우, 전복, 오징어, 가리비, 쌈배추, 청경채, 야채, 팽이버섯, 느타리버섯, 표고버섯","[양념장(밥숟가락 기준)]: 진간장, 간마늘, 후추, 식초, 설탕"
7057365,2,20분,아무나,[주재료]: 활전복,"[양념]: 참기름, 소금, 초장"
7057364,4,10분,아무나,"[재료]: 동치미무, 고춧가루, 설탕, 통깨",양념 없음
7057363,3,30분,아무나,"[주재료]: 소고기, 상추, 무, 콩나물, 부추, 애호박, 오이, 당근","[양념]: 고추장, 참기름, 마늘, 소금, 간장, 설탕"
7057362,2,30분,아무나,"[주재료]: 양송이버섯, 통마늘","[양념]: 식용유, 버터, 간장, 설탕"
7057361,인분 정보 없음,소요 시간 정보 없음,아무나,"[주재료]: 크래미, 계란, 대파","[양념]: 버터, 간장, 소금"
7057360,4,30분,아무나,"[재료]: 갑오징어, 양파, 대파, 식용유, 굵은소금","[양념장]: 고춧가루, 고추장, 진간장, 설탕, 맛술, 다진마늘, 알룰로스, 참기름, 통깨, 후추"
7057359,2,20분,아무나,"[재료]: 부추, 당근, 냉동 가리비살, 계란, 팽이버섯, 부침가루, 튀김가루, 물, 식용유",양념 없음
7057358,2,15분,아무나,"[재료]: 메밀면, 시판 냉면육수, 쯔유, 설탕, 통깨",양념 없음
7057357,6 이상,30분,아무나,"[재료]: 햇감자 큰사이즈, 오이, 당근, 양파, 마요네즈, 머스타드, 소금, 후추",양념 없음
7057356,2,15분,아무나,"[재료]: 새송이버섯, 식용유, 다진마늘, 진간장, 소금, 알룰로스, 참기름, 통깨",양념 없음
7057355,1,30분,초급,"[재료]: 만두피, 김치, 감자, 양파, 대파, 물, 코인육수, 새우젓, 참치액, 간마늘",양념 없음
7057354,4,30분,초급,"[재료]: 버터, 계란, 흰설탕, 박력분, 초코칩, 호두, 소금, 베이킹소다, 베이킹파우더",양념 없음
7057353,2,30분,초급,"[재료]: 양배추, 사과, 당근, 닭가슴살, 월계수잎, 라이스페이퍼",양념 없음
7057352,4,60분,초급,"[재료]: 닭다리살, 그릭요거트, 소금, 카레파우더, 파프리카파우더, 간마늘, 생강청, 레몬즙, 후추, 올리브오일, 버터, 양파, 토마토홀, 물, 카레 고체가루, 설탕, 코코넛밀크",양념 없음
7057351,3,30분,초급,"[재료]: 꽃게, 쌀뜨물, 코인육수, 된장, 청주, 무, 양파, 대파, 간마늘, 고춧가루, 애호박, 두부",양념 없음
7057350,2,15분,아무나,"[양념 재료]: 진간장, 물, 설탕, 참기름, 식초",양념 없음
7057349,4,30분,초급,"[재료]: 콩나물, 다시마, 다진마늘, 국간장, 매실액, 청양고추, 얼음, 실고추, 소금",양념 없음
7057348,4,30분,초급,"[재료]: 메추리알, 감자, 다진마늘, 통깨, 부추, 대파","[메추리알감자조림 양념장]: 간장, 물엿, 고추장, 고춧가루"
7057347,1,10분,아무나,"[재료]: 소세지, 밥, 계란","[양념]: 쯔유, 다진마늘, 후추, 버터"
7057346,4,30분,아무나,"[재료]: 알감자, 간장, 원당, 다진 마늘, 참기름, 올리브유, 물, 조청, 통깨",양념 없음
7057345,4,60분,아무나,"[부재료]: 고춧가루, 다진마늘, 진간장, 설탕, 건조마늘가루, 맛술, 된장, 코인육수, 물",양념 없음
7057344,3,20분,아무나,"[재료]: 돼지고기 삼겹살, 감자 1개, 애호박, 양파, 대파, 다진 마늘, 고추장, 된장, 고춧가루, 국간장, 까나리액젓, 참기름, 물",양념 없음
7057343,4,30분,아무나,"[감자 된장국 재료]: 감자, 양파, 청양고추, 대파, 멸치","[감자 된장국 양념]: 된장, 다진마늘, 소금"
7057342,3,60분,초급,"[양념장 재료]: 고춧가루, 고추장, 진간장, 참치액, 국간장, 맛술, 요리당, 다진 마늘",양념 없음
7057341,2,30분,아무나,"[재료]: 당근, 사과, 아몬드 가루, 요거트, 달걀",양념 없음
7057340,2,15분,아무나,재료 없음,양념 없음
7057339,3,15분,아무나,"[재료(계량:숟가락)]: 가지, 설탕, 진간장, 들기름, 대파, 다진 마늘, 통깨",양념 없음
7057338,3,60분,초급,"[재료소개 (1큰술 = 15ml / 1작은술 = 5ml)]: ​ 당근, 감자, 무, 양파, 버터, 소금, 물, 우유, 설탕, 다진마늘, 밥, 생크림, 땅콩",양념 없음
7057337,3,60분,초급,"[재료소개]: 고구마, 양파, 버터, 우유, 생크림, 소금, 후추",양념 없음
7057336,2,15분,초급,"[재료]: 어묵, 꽈리고추, 빨간 파프리카, 오일",양념 없음
7057335,2,10분,초급,"[재료]: 수박 장아찌, 고추가루, 청양고추, 대파, 참기름, 참깨",양념 없음
7057334,2,30분,초급,"[재료]: 오이, 양배추, 양조간장, 설탕, 식초, 참기름, 깨소금",양념 없음
7057333,1,2시간 이상,초급,"[재료]: 깐 멍게, 밥, 어린 채소, 쪽파, 홍고추, 청양고추","[양념]: 고춧가루, 꽃게액젓, 다진마늘, 매실청, 황설탕, 생강가루"
7057332,2,60분,중급,"[재료]: 양송이버섯, 양파, 블랙올리브, 소시지, 토마토소스, 피자치즈, 파슬리가루, 올리브유",양념 없음
7057331,1,15분,초급,"[양념재료]: 김치국물, 다진마늘, 고춧가루, 참치액, 맛술, 국간장, 맛소금, 참기름, 깨소금",양념 없음
7057330,3,30분,초급,"[재료]: 떡, 어묵, 비엔나소시지, 대파, 물, 동전육수, 삶은계란, 튀김","[양념소스]: 고추장, 고춧가루, 설탕, 진간장, 물엿, 후춧가루"
7057329,4,5분,아무나,"[재료]: 오이고추, 된장, 고춧가루, 땅콩소스, 매실청, 설탕, 미림, 참기름, 깨, 미원",양념 없음
7057328,3,30분,초급,"[재료]: 감자, 오이, 소금, 타르타르소스, 파슬리",양념 없음
7057327,6 이상,2시간 이상,중급,"[재료]: 우거지, 된장, 고추장, 고춧가루, 설탕, 맛술, 국간장, 참치액, 후추, 다진 마늘, 생강, 들기름, ​ 돼지고기 앞다리살, 들깨가루",양념 없음
7057326,3,20분,아무나,[소바 육수 재료]: 생수,양념 없음
7057325,3,30분,아무나,"[재료]: 감자, 물, 소금, 황설탕",양념 없음
7057324,4,30분,아무나,"[재료]: 대파, 식용유, 양파, 잡채용 등심, 물, 짜장가루",양념 없음
7057323,6 이상,30분,중급,[주재료]: 수박,양념 없음
7057322,4,90분,초급,"[재료]: 토종닭, 찹쌀, 대파, 소금, 통마늘, 월계수, 대추, 생강, 부추, 백숙용한방재료",양념 없음
7057321,2,60분,초급,"[재료]: 감자, 애호박, 버터, 샌드위치햄, 파마산치즈가루, 파슬리가루",양념 없음
7057320,2,15분,아무나,"[두부감자채전 재료]: 감자, 두부, 부침가루, 슬라이스치즈, 눈꽃치즈, 식용유, 파슬리가루, 소금, 후추",양념 없음
7057319,2,15분,아무나,"[치킨 야채 베이글 샌드위치 재료]: 베이글, 바질페스토, 닭가슴살, 허니머스터드, 스윗엔 샤워크림, 눈꽃치즈, 채썬 양배추, 당근라페, 오이",양념 없음
7057318,1,15분,초급,"[재료]: 양배추, 냉동다진 청양고추, 국수, 생들기름, 간장, 메밀소바장국, 조미 도시락김, 들깨가루",양념 없음
7057317,2,30분,초급,"[재료]: 밥, 캔참치, 마요네즈, 김치, 김가루, 참기름, 깨, 후추, 소금",양념 없음
7057316,3,30분,초급,"[재료]: 감자, 모차렐라치즈, 옥수수콘, 양파, 우유, 소금, 토마토소스, 소시지",양념 없음
7057315,1,5분,아무나,"[재료]: 두부, 완숙토마토, 발사믹, 알룰로스, 파슬리",양념 없음
7057314,6 이상,2시간 이상,초급,"[쯔유 재료]: 미림, 청주, 설탕, 진간장, 가쓰오부시",양념 없음
7057313,2,60분,초급,"[재료 (계량 : 밥숟가락)]: 가지, 돼지고기 다짐육, 양파, 대파, 모차렐라치즈, 다진 마늘, 토마토소스, 아보카도오일, 파슬리가루, 허브솔트",양념 없음
7057312,4,30분,초급,"[재료]: 돼지고기 다짐육, 양파, 대파, 식용유",[쌈밥 밥 양념]: 참기름
7057311,3,60분,초급,"[재료]: 대파, 대파, 삼겹살, 양파, 맛술, 허브솔트",양념 없음
7057310,3,15분,초급,"[재료]: 삶은계란, 올리브오일, 식초, 소금",양념 없음
7057309,1,30분,아무나,"[주 재료]: 당근, 감자, 소금, 후추, 감자전분, 치즈",양념 없음
7057308,4,20분,초급,"[재료]: 오이, 토마토, 삶은 계란",양념 없음
7057307,2,20분,아무나,"[재료]: 무, 양파, 물, 간장, 다진마늘, 설탕, 고춧가루, 청양고춧가루, 고추장, 굴소스, 참치캔, 청양고추",양념 없음
7057306,2,30분,초급,"[재료]: 라이스페이퍼, 닭가슴살, 크래미, 빨강 파프리카, 노랑파프리카, 양파, 오이, 당근, 상추, 월남쌈소스",양념 없음
7057305,4,60분,중급,"[재료]: 양배추, 달걀, 모짜렐라치즈, 소금, 후추, 파슬리, 파프리카가루, 오일",양념 없음
7057304,3,10분,아무나,[재료]: 무,"[양념]: 물, 소금, 설탕, 올리고당, 식초, 고춧가루"
7057303,2,15분,아무나,"[재료]: 청포묵, 숙주, 다진대파","[양념]: 소금, 참기름, 흑임자"
7057302,2,30분,초급,"[재료]: 공심채, 굴소스, 다진마늘, 참치액, 액젓, 참기름, 통깨, 식용유",양념 없음
7057301,6 이상,10분,중급,"[재료]: 진미채, 고추장, 고춧가루, 물엿, 진간장, 다진 마늘, 맛술, 식용유, 통깨",양념 없음
7057300,2,30분,아무나,"[양념재료]: 진간장, 굴소스, 알룰로스, 올리고당, 고춧가루, 케첩, 다진마늘, 후춧가루, 청양고추",양념 없음
7057299,3,5분,초급,"[재료]: 상추, 양파","[겉절이양념장]: 고춧가루, 다진 마늘, 진간장, 식초, 설탕, 참기름, 통깨"
7057298,2,10분,아무나,"[메인재료]: 당면, 당근, 양파, 버섯","[양념]: 물, 굴소스, 간장, 설탕, 후추, 통깨"
7057297,3,10분,초급,"[재료]: 깻잎, 계란, 식용유, 전분가루, 튀김가루, 냉수, 소금","[양념]: 대파, 청양고추, 진간장, 참치액, 물, 다진 마늘, 설탕, 맛술, 고춧가루, 참기름, 후춧가루"
7057296,3,10분,아무나,"[재료]: 브로콜리, 마늘, 올리브오일, 소금, 간장, 통깨",양념 없음
7057295,6 이상,30분,초급,"[재료]: 병아리콩, 소금, 버터, 마늘, 베이컨, 샐러리, 통깨, 물, 올리브유",양념 없음
7057294,5,30분,초급,"[재료]: 호박잎, 양파, 호박, 감자, 고추","[양념]: 된장, 고추장, 다진마늘, 조미료, 다진파"
7057293,4,30분,초급,[재료]: 새송이버섯,"[양념]: 식용유, 다진마늘, 고춧가루, 고추장, 진간장, 올리고당, 참기름, 통깨"
7057292,6 이상,15분,아무나,"[재료]: 방울토마토, 양파",양념 없음
7057291,1,5분,아무나,"[토핑재료]: 바닐라아이스크림, 코코아파우더, 빼빼로",양념 없음
7057290,4,30분,아무나,"[재료]: 표고버섯 밑동, 후추, 소금, 김밥용김, 깨",양념 없음
7057289,2,30분,아무나,"[재료]: 절단 낙지, 대파, 양파, 청양고추, 고추기름, 참기름, 통깨, 밀가루, 굵은소금","[양념]: 고춧가루, 양조간장, 다진 마늘, 맛술, 설탕, 고추장, 후추"
7057288,6 이상,20분,아무나,"[ 재료 / 6인분 ]: 꽈리고추, 슬라이스 유부, 마늘, 매실청, 맛술, 굴소스, 참치액젓, 간장, 양파, 청양고추, 물엿, 참기름, 깨",양념 없음
7057287,2,60분,아무나,"[재료]: 닭 윗날개, 튀김가루, 우유, 식용유, 통깨",양념 없음
7057286,5,30분,초급,"[재료]: 감자, 삶은 계란, 오이, 당근, 양파, 옥수수콘",양념 없음
7057285,2,20분,아무나,"[재료]: 김치, 참치, 스팸, 두부","[양념]: 고춧가루, 설탕, 양조간장, 다진마늘, 김치국물, 참치액"
7057284,1,5분,아무나,"[재료]: 냉동 블루베리, 올리고당, 레몬즙, 얼음, 탄산수",양념 없음
7057283,2,30분,아무나,"[재료]: 미역, 황태","[양념]: 참치액, 다진마늘, 맛소금"
7057282,4,90분,초급,"[재료]: 돼지앞다리살, 대파, 마늘, 물, 설탕, 간장, 청주, 미림, 월계수잎, 통후추",양념 없음
7057281,2,30분,초급,"[재료]: 김밥김, 메밀면, 들기름, 계란, 미림, 쯔유, 아보카도","[소바양념]: 쯔유, 물, 실파"
7057280,3,30분,초급,재료 없음,"[양념장]: 진간장, 두반장, 액상 알룰로스, 고춧가루, 물, 소주"
7057279,3,30분,초급,"[재료]: 기름, 돼지고기, 후추, 양파, 대파, 김치, 설탕, 물, 코인육수, 간마늘",양념 없음
7057278,3,30분,아무나,"[재료]: 신김치, 콩나물, 사각어묵, 대파, 두부, 물, 코인육수, 고춧가루, 참치액, 다진마늘, 굵은소금, 후추",양념 없음
7057277,4,2시간 이상,아무나,"[재료]: 프레첼, 계란흰자, 하얀설탕, 바닐라빈익스트랙, 레몬즙",양념 없음
7057276,4,30분,초급,"[재료]: 김밥김, 쌀, 아보카도, 스팸, 시금치, 소금, 참기름, 당근, 무장아찌, 계란, 미림",양념 없음
7057275,4,60분,아무나,"[기본재료]: 손질된 아귀, 대파, 미나리, 콩나물, 물, 코인육수, 굵은소금, 식초, 소주","[양념]: 고춧가루, 간장, 간생강, 설탕, 다진마늘, 참치액, 맛술, 다시다"
7057274,1,15분,아무나,"[재료]: 메밀면, 쯔유, 들기름, 진간장, 설탕, 통깨, 쪽파, 김가루",양념 없음
7057273,3,30분,중급,"[재료]: 브로콜리, 달걀, 아몬드분말, 소금, 슈가파우더",양념 없음
7057272,6 이상,60분,아무나,"[재료]: 대파, 양파, 다시마, 코인육수, 가쓰오부시, 간생강, 물, 진간장, 설탕",양념 없음
7057271,4,60분,초급,"[월남쌈재료]: 당근, 오이, 깻잎, 파프리카",양념 없음
7057270,3,30분,아무나,"[재료]: 김치, 밥, 스팸","[양념]: 고추가루, 설탕, 참기름, 미원, 통깨, 버터, 맛간장, 미원"
7057269,2,20분,아무나,"[재료]: 신김치, 냉장 우동면, 사각어묵, 대파, 청양고추, 물, 코인육수, 멸치액젓, 참치액젓, 김치국물, 다진마늘, 고춧가루, 식용유",양념 없음
7057268,2,30분,초급,"[재료]: 기름, 간돼지고기, 홍고추, 청피망, 양파, 대파흰부분, 미림, 진간장, 설탕, 굴소스, 고춧가루, 마라소스, 간마늘, 생강청, 후추, 치킨스톡, 마파소스, 물, 전두부, 감자전분",양념 없음
7057267,1,5분,아무나,"[재료]: 멸균 우유, 단팥, 빙수떡, 그레놀라, 견과류",양념 없음
7057266,3,20분,초급,"[재료]: 백오이, 소금, 불고기",양념 없음
7057265,2,30분,아무나,"[재료]: 두부, 들기름, 콩기름, 열무얼갈이김치, 자일로스설탕, 들기름, 내장제거 멸치",양념 없음
7057264,4,60분,아무나,"[재료]: 돼지고기 앞다리살, 물, 맛소금, 된장, 대파, 청양고추, 고춧가루, 진간장, 매실청, 다진마늘, 참기름, 깨소금",양념 없음
7057263,4,20분,초급,"[재료]: 햇감자, 소금",양념 없음
7057262,2,30분,초급,"[재료]: 청양고추, 당근, 어묵, 밥, 김밥용김, 참기름, 통깨, 식용유, 마요네즈","[양념]: 곰표조림볶음맛간장, 굴소스, 다진 마늘, 올리고당, 맛술"
7057261,1,10분,아무나,"[재료]: 미나리, 깻잎, 현미찹쌀가루, 달걀, 소금, 아보카도오일",양념 없음
7057260,1,20분,초급,"[재료]: 우삼겹, 신김치, 식초, 참치액, 알룰로스, 들기름, 대파, 청양고추, 김가루, 메밀면, 들기름, 쯔유, 알룰로스, 식초, 고춧가루",양념 없음
7057259,2,15분,초급,"[재료]: 옥수수콘 통조림, 버터, 마요네즈, 모짜렐라치즈, 파슬리가루, 간마늘",양념 없음
7057258,4,10분,아무나,"[재료]: 사각어묵, 물, 간장, 후추, 설탕, 고춧가루, 청양고추",양념 없음
7057257,4,20분,아무나,"[재료]: 메주콩, 물, 소면, 오이, 소금",양념 없음
7057256,2,20분,아무나,"[재료]: 늙은 오이, 소금, 고춧가루, 다진 마늘, 식초, 매실액, 액젓, 참기름, 통깨",양념 없음
7057255,1,20분,초급,"[재료준비]: 해물믹스, 미림, 양배추, 대파, 양파, 애호박, 청양고추","[양념]: 식용유, 다진마늘, 진간장, 일반 고춧가루, 청양고춧가루, 굴소스, 미림, 멸치액젓, 참치액, 미원, 소금, 후추, 물, 당면, 계란"
7057254,2,5분,아무나,"[재료]: 새송이버섯, 계란, 소금, 참기름, 전분가루",양념 없음
7057253,4,20분,아무나,"[재료]: 검은콩, 다시마, 소금, 물",양념 없음
7057252,4,60분,아무나,"[재료]: 양배추, 오이, 방울토마토, 양파, 적채, 소금, 후추, 레몬즙, 올리브오일, 귤청, 적 파프리카, 황 파프리카",양념 없음
7057251,4,2시간 이상,아무나,"[냉수육 재료]: 돼지앞다리살, 소금","[냉수육 양념장]: 청양고추, 홍고추, 대파, 깻잎, 다진마늘, 국간장, 식초, 설탕, 깨소금, 참기름"
7057250,3,90분,중급,"[만두속양념재료]: 다진마늘, 참기름, 소금, 후추",양념 없음
7057249,4,120분,중급,"[재료소개 (1큰술 = 15ml)]: 찹쌀, 쑥, 굵은소금, 소금, 콩가루, 설탕",양념 없음
7057248,1,10분,아무나,"[모듬새싹 계란 비빔밥 재료]: 밥, 모듬새싹, 계란후라이, 고추장, 참기름, 깨",양념 없음
7057247,3,15분,아무나,"[매콤감자조림 재료]: 감자, 다진마늘, 간장, 굴소스, 올리고당, 청양고추, 올리브오일, 깨",양념 없음
7057246,4,5분,아무나,"[재료]: 라면스프, 순두부, 계란, 대파, 물","[양념]: 굴소스, 참치액젓, 다진마늘, 고춧가루"
7057245,3,30분,초급,"[재료]: 감자, 소금, 식용유",양념 없음
7057244,2,30분,초급,"[재료]: 신김치, 스팸, 설탕, 식용유, 대파, 고춧가루, 진간장, 밥, 참기름",양념 없음
7057243,1,30분,아무나,"[재료]: 우동면, 표고버섯, 대파, 물, 유부","[양념]: 된장, 참치액젓, 고춧가루"
7057241,1,15분,초급,"[양념장 재료]: 간장, 올리고당, 맛술, 물, 다진 마늘",양념 없음
7057240,4,60분,초급,"[재료]: 두부, 소고기다짐육, 파, 전분가루, 식용유, 미림, 후추, 참기름, 깨, 진간장, 굴소스, 미림, 다진마늘, 설탕, 후추, 물",양념 없음
7057239,2,15분,초급,"[재료]: 오이, 닭가슴살",양념 없음
7057238,인분 정보 없음,20분,초급,"[재료]: 당근, 양배추, 소금","[양념]: 올리브오일, 홀그레인, 레몬즙, 올리고당, 후추, 소금"
7057237,인분 정보 없음,소요 시간 정보 없음,초급,[재료]: 양파,양념 없음
7057236,2,10분,아무나,"[재료]: 케첩, 진간장, 설탕, 다진 마늘, 식용유, 밀가루, 식초, 물, 후춧가루",양념 없음
7057235,3,30분,아무나,"[재료]: 오이, 빨강 파프리카, 노랑 파프리카, 양파, 냉면육수, 생수, 깨소금",양념 없음
7057234,4,20분,초급,"[재료]: 감자, 삶은계란, 오이, 마요네즈, 소금, 허니머스타드소스, 설탕, 모닝빵",양념 없음
7057233,4,20분,초급,"[양념장 재료]: 진간장, 맛술, 설탕, 요리당, 다진 마늘, 고춧가루, 후춧가루, 통깨, 참기름",양념 없음
7057232,4,15분,아무나,"[재료]: 오이, 고추장, 다진파, 다진마늘, 식초, 알룰로스",양념 없음
7057231,1,10분,아무나,"[재료]: 토마토, 계란, 토마토소스, 바질, 파슬리가루, 채소, 파마산치즈가루, 식용유, 후추",양념 없음
7057230,2,20분,초급,"[재료]: 콩나물, 고춧가루, 참기름, 통깨, 부추, 소금",양념 없음
7057229,4,60분,초급,"[재료]: 삶은달걀, 소고기다짐육, 꽈리고추, 실고추, 통깨","[양념]: 간장, 물엿, 미림, 참치액, 매실액, 설탕"
7057228,3,15분,아무나,"[재료]: 피망, 소시지, 양파","[양념]: 다진파, 다진마늘"
7057227,3,20분,아무나,"[재료]: 콩나물, 액젓, 다진 마늘, 들기름, 건 새우가루, 대파, 깨소금",양념 없음
7057226,4,60분,아무나,"[재료]: 소갈비, 무, 당근, 표고버섯, 청양고추, 대파, 물, 월계수잎, 진간장, 설탕, 배즙, 다진 마늘, 생강가루, 맛술, 참기름, 후추, 올리고당",양념 없음
7057225,4,15분,아무나,"[부재료]: 소금, 매실청, 식초, 물, 깨소금, 레몬즙",양념 없음
7057224,4,30분,아무나,"[재료]: 소고기, 무, 콩나물, 대파, 마늘, 액젓, 진간장, 고춧가루, 청양고춧가루, 참기름, 후추, 소금, 물, 가루육수",양념 없음
7057223,4,15분,초급,[재료]: 황태채,"[양념]: 고추장, 고춧가루, 양조간장, 미림, 아카시아꿀, 갈릭파우더"
7057222,1,30분,초급,"[재료]: 라이스페이퍼, 오이, 빨강파프리카, 노랑파프리카, 당근, 게맛살, 계란, 오이, 죽염",양념 없음
7057221,3,10분,아무나,"[재료]: 팽이버섯, 새송이버섯, 파프리카, 대파 흰부분, 애호박, 고추, 다진마늘",양념 없음
7057220,4,15분,아무나,"[재료]: 콩나물, 무, 고춧가루, 진간장, 다진 마늘, 참기름, 매실액, 통깨, 대파, 고운 소금",양념 없음
7057219,4,30분,초급,"[재료]: 쥐포 구이채, 고추장, 고춧가루, 물엿, 설탕, 간장, 맛술, 다진 마늘, 식용유, 참기름, 통깨",양념 없음
7057218,인분 정보 없음,소요 시간 정보 없음,초급,"[재료(2인분)]: 파스타면, 양파, 노란 파프리카, 빨간 파프리카, 소시지, 다진마늘",양념 없음
7057217,2,15분,아무나,"[재료]: 오이, 양파, 깨, 소금, 설탕, 맛술, 참치액",양념 없음
7057216,3,60분,초급,"[재료]: 돼지고기, 감자, 양파, 애호박, 대파, 청양고추, 두부, 식용유, 소금, 물","[양념]: 고추장, 고춧가루, 다진마늘, 설탕, 간장, 액젓, 후추, 코인육수"
7057215,2,30분,중급,"[노각비빔국수 재료]: 노각, 국수, 청양고추, 홍고추, 대파 흰대","[노각비빔국수 양념]: 다진마늘, 고추가루, 간장, 깨소금, 참기름"
7057214,1,10분,아무나,"[갈릭 스테이크 재료]: 스테이크 고기, 야채, 스테이크소스, 시즈닝, 갈릭후레이크",양념 없음
7057213,2,10분,아무나,"[양배추 계란 토스트 재료]: 계란, 당근, 양배추, 버터, 치즈식빵, 마요네즈, 눈꽃치즈, 케찹",양념 없음
7057212,2,30분,초급,"[재료]: 돼지고기 앞다리살, 양파, 당근, 다진마늘, 대파, 부추, 청양고추",양념 없음
7057210,5,30분,초급,"[소스재료]: 마요네즈, 레몬즙, 식초, 까나리액젓, 설탕, 다진 마늘, 파마산치즈가루, 후춧가루",양념 없음
7057209,4,60분,중급,"[재료]: 염장미역줄기, 양파, 다진마늘, 식용유, 양조간장, 설탕, 참기름, 통깨, 후춧가루",양념 없음
7057208,4,30분,초급,"[재료]: 오이, 가지, 양파, 청양고추, 냉면육수, 얼음, 식초, 매실청, 다진마늘, 깨",양념 없음
7057207,6 이상,90분,고급,"[재료]: 박력분, 달걀, 설탕, 코코아파우더, 베이킹 소다, 물, 우유, 생크림, 설탕, 코코아파우더",양념 없음
7057206,6 이상,2시간 이상,중급,"[재료]: 감자, 생크림, 피자치즈, 달걀, 설탕",양념 없음
7057205,3,2시간 이상,중급,"[재료]: 연어, 마요네즈, 날치알, 스리라차, 레몬즙, 생와사비",양념 없음
7057203,2,10분,아무나,"[재료]: 오이, 김밥김, 밥, 크래미, 마요네즈, 홀그레인머스타드",양념 없음
7057202,4,30분,아무나,"[재료]: 감자, 스팸, 대파, 양파, 청양고추, 다진 마늘, 식용유, 통깨","[양념]: 설탕, 올리고당, 맛술, 진간장, 멸치액젓, 굴소스, 고춧가루, 물, 참기름, 후추"
7057201,6 이상,30분,중급,"[재료]: 비트, 토마토, 파프리카, 브로콜리, 사과, 양배추, 당근, 소금, 레몬즙, 물",양념 없음
7057200,4,30분,아무나,"[재료]: 콩나물, 대패삼겹살, 대파, 양파, 팽이버섯, 홍고추, 청양고추, 깻잎, 통깨","[양념]: 설탕, 고춧가루, 고추장, 맛술, 진간장, 멸치액젓, 다진 마늘, 생강가루"
7057199,4,20분,아무나,"[재료]: 사각 어묵, 대파, 양파, 당근, 다진마늘, 식용유, 통깨","[양념]: 설탕, 진간장, 멸치액젓, 굴소스, 올리고당, 참기름"
7057198,4,30분,초급,"[재료]: 우삼겹, 다담된장양념, 집된장, 두부, 팽이버섯, 청양고추, 동전육수",양념 없음
7057197,3,30분,아무나,"[재료]: 생지, 블루베리잼",양념 없음
7057196,5,30분,아무나,"[재료]: 감자, 사과, 당근","[양념 ]: 마요네즈, 설탕, 소금"
7057195,1,15분,아무나,"[재료]: 메밀면, 다진 대파, 김가루, 삶은 달걀","[양념]: 간장, 설탕, 들기름"
7057194,5,30분,아무나,"[재료]: 돼지고기, 배추김치, 대파, 두부 작은","[양념]: 다진마늘, 생강술, 설탕, 국간장, 후추가루"
7057193,2,90분,중급,"[재료]: 알배추, 부추, 양파, 건고추, 고추가루","[믹서에 갈아주는 양념]: 마늘, 생강, 양파, 까나리액젓, 꽃게액젓, 새우젓, 배즙음료, 설탕, 찹쌀죽"
7057192,5,30분,아무나,"[재료]: 무말랭이, 사이다, 까나리액젓, 다진 홍고추, 다진마늘, 다진생강, 참치액젓, 고춧가루, 매실액, 맛술, 깨, 물엿, 까나리액젓",양념 없음
7057187,3,20분,아무나,"[재료]: 라디쉬, 고구마, 당근, 브로콜리, 컬리플라워, 그린빈, 근대, 적치커리, 블랙올리브, 케이퍼, 엔초비, 올리브오일, 소금, 레몬즙",양념 없음
7057186,3,2시간 이상,초급,"[재료]: 돼지고기 통삼겹 약, 소금, 황설탕, 설탕",양념 없음
